"article","title","url"
"Bank Indonesia dan Reserve Bank of Australia memutuskan untuk memperpanjang kerja sama Bilateral Local Currency Swap Arrangement (BCSA) di antara keduanya yang akan berakhir pada Desember 2018.   Gubernur Bank Indonesia (BI) Perry Warjiyo mengatakan, perpanjangan kerja sama BCSA tersebut berlaku efektif selama tiga tahun mendatang. Dengan demikian, dimungkinkan  mata uang lokal di antara dua bank sentral senilai AUD$ 10 miliar atau Rp 100 triliun.   “Kerja sama ini bagian dari upaya BI yang berkelanjutan untuk mendorong perdagangan bilateral terutama untuk menjamin penyelesaian transaksi perdagangan dalam mata uang local antara dua negara,” katanya melalui siaran pers yang diterima  Kamis (9/8).   (Baca juga:  )   Keputusan untuk melanjutkan kerja sama BCSA di antara Indonesia – Australia ditetapkan dalam gelaran pertemuan gubernur bank sentral Executives Meeting of East Asia-Pasific (EMEAP). Acara ini berlangsung di Manila, Filipina pada 5 Agustus 2018.   Bank sentral menekankan, perpanjangan BCSA ini juga mencerminkan penguatan kerja sama keuangan antara Indonesia dan Australia. BI maupun bank sentral Australia berusaha meningkatkan penggunaan mata uang masing-masing negara untuk mengurangi ketergantungan terhadap valas tertentu.","BI Perpanjang BCSA dengan Australia Sampai 2021","http://katadata.co.id/berita/2018/08/09/bi-perpanjang-bcsa-dengan-australia-sampai-2021"
"Nasabah pemegang kartu debit Standard Chartered Bank Indonesia sekarang bisa bertransaksi melalui seluruh jaringan mesin ATM dan EDC yang dikelola PT Rintis Sejahtera alias jaringan Prima.   Kerja sama Standard Chartered Bank Indonesia dengan perusahaan  Rintis Sejahtera diharapkan dapat memperluas jangkauan layanan bagi para nasabah. Mulai sekarang, sekitar 31.000 nasabah pemegang kartu debit bisa memanfaatkan 120.000 mesin ATM Prima.   ""Selain mencerminkan kepatuhan bank terhadap regulator, kerja sama ini disepakati dalam rangka mendukung program GPN yang digagas Bank Indonesia,"" kata CEO Standard Chartered Bank Indonesia Rino Donosepoetro dalam siaran pers yang diterima  Jumat (10/8).   (Baca juga:  )   Sebaliknya, seluruh nasabah dari 78 bank yang bermitra dengan jaringan Prima juga bisa bertransaksi melalui mesin ATM milik Standard Chartered Bank Indonesia. Rino berharap, kerja sama ini dapat meningkatkan utilisasi jaringan perbankannya.   “Nasabah Priority Banking kami bisa gratis biaya transfer di jaringan Prima karena termasuk dalam jaringan transaksi domestik. Ini merupakan salah satu dukungan kami terhadap inisiatif   yang digagas pemerintah,"" ujarnya.   Sementara itu, Direktur Utama PT Rintis Sejahtera Iwan Setiawan berharap, kemitraan dengan Standard Chartered Bank Indonesia bisa mempermudah transaksi perbankan di dalam negeri. Perseroan mendukung industri perbankan bertransformasi lebih jauh ke arah digital.  ","Kini Nasabah Standard Chartered Bisa Transaksi Via ATM Prima","http://katadata.co.id/berita/2018/08/10/kini-nasabah-standard-chartered-bisa-transaksi-via-atm-prima"
"Citibank N.A. Indonesia membukukan laba bersih sebesar Rp 835,3 milar sepanjang semester I-2018, turun 38,3% dari periode yang sama tahun lalu yang mencapai Rp 1,3 triliun. Penurunan ini terjadi akibat cadangan kredit, meski penyaluran kreditnya masih tumbuh. Chief Executive Officer Citibank Indonesia Batara Sianturi mengatakan, penurunan laba bersih disebabkan oleh  cadangan kerugian kredit pada triwulan I-2017. Hal itu dipengaruhi penyaluran kredit komersial. ""Kami membukukan tambahan cadangan kerugian kredit, sejalan dengan kredit yang tadi tumbuh 19%,"" kata Batara dalam konferensi dengan media di Jakarta, Senin (13/8). Portofolio kredit Citibank meningkat 19% dibanding capaian periode yang sama tahun lalu menjadi Rp 47,5 triliun. Pertumbuhan kredit itu didorong oleh pertumbuhan pada lini bisnis kredit korporasi. Batara mengatakan, ada empat sektor industri yang menjadi penyokong terbesar pertumbuhan kredit di Semester I-2018 yaitu sektor perantara keuangan, sektor pertambangan dan penggalian, sektor pengolahan, dan sektor perdagangan besar dan eceran. (Baca:  ) Batara optimis permintaan kredit banknya tetap stabil hingga akhir tahun ini. Hal ini yang membuat perusahaan merasa mampu menggenjot pertumbuhan kredit. ""Pertumbuhan kredit dan DPK (Dana Pihak Ketiga) sudah di atas target semester I-2018 kami, yaitu masing-masing tumbuh 8%,"" kata Barata. Dalam laporan keuangan Citibank, DPK pada semester I-2018 tumbuh 15% menjadi Rp 58,25 triliun. Hal ini memungkinkan Citibank untuk mempertahankan rasio   (RIM) yang solid menjadi sebesar 77,7%.  Meski penyalurannya tumbuh, kualitas kredit perusahaan sedikit menurun. Ini tercermin dari rasio kredit macet atau   (NPL) sebesar 2,34%. Pada semester yang sama tahun lalu, NPL Citibank Indonesia berada di angka 2,26%. ""NPL memang naik, karena ada kredit yang sedang proses   Kalau dibandingkan tahun lalu, agak tinggi di sektor kredit komersial. Tapi proyeksi kami masih terjaga dengan NPL di bawah 3%,"" kata Batara.  Pendapatan bunga bersih turun 6,2% menjadi Rp 2,09 triliun, akibat beban bunga yang meningkat sebesar 11,25% menjadi Rp 593,2 miliar pada Semester I-2018. Adapun, margin bunga bersih atau   (NIM) Citibank turun dari 6,69% pada semeter I-2017, menjadi 5,87%. NIM terkoreksi hampir 100 basis poin (bps), karena NIM tahun lalu cukup tinggi. Beberapa faktor yang menyebabkan menurunnya NIM pada Semester I-2018, karena pihaknya belum menyesuaikan tingkat bunga pada periode itu. Alasan lainnya yaitu, adanya penambahan beban bunga akibat bunga deposito yang naik setelah Bank Indonesia (BI) menaikkan suku bunga acuannya. (Baca:  )","Laba Citibank Indonesia Anjlok 38%, Kredit Bermasalah Naik 2,34%","http://katadata.co.id/berita/2018/08/13/laba-citibank-indonesia-anjlok-38-kredit-bermasalah-naik-234"
"Perluasan akses pertukaran informasi perpajakan antarnegara dapat meresahkan nasabah bank yang notabene wajib pajak (WP). Tapi perbankan menyatakan respons ini bersifat sementara. Saling suplai data antarnegara juga diyakini tidak berpengaruh terhadap kinerja bank. Direktur Keuangan PT Bank Negara Indonesia (Persero) Tbk. Anggoro Eko Cahyo menuturkan, sekalipun muncul kekhawatiran nasabah atas penerapan Automatic Exchange of Information (AEoI) hanya terjadi pada periode awal sosialisasi saja. “Sebenarnya, biasanya kekhawatiran itu muncul pada awal saja. Orang mungkin merasa, kok uangnya diketahui. Tapi ini tidak ada (dampak kepada kinerja bank),” katanya, di Jakarta, Selasa (28/8). Pelaksanaan AEoI mulai September 2018 dapat memicu nasabah besar mengurangi jumlah simpanannya di bank supaya tidak menjadi konsumsi petugas pajak. Apabila keresahan semacam ini meluas dapat berpengaruh terhadap kinerja penghimpunan dana. Namun menurut Anggoro, kondisi itu tidak perlu terjadi. Selama aset yang disimpan di bank wajar maka nasabah tidak perlu resah hingga menarik simpanan. Sikap sembunyi-sembunyi WP justru bisa menimbulkan asumsi tendensius otoritas pajak. “Sebenarnya kalau masyarakat tidak ada yang disembunyikan kenapa mesti khawatir. Kalau transaksinya wajar-wajar saja, kenapa khawatir? Ini untuk masyarakat pada umumnya ya,” tuturnya. (Baca juga:  ) Dua tahun selepas diterapkan, AEoI akan ditinjau kembali pelaksanaannya oleh OECD (Organisation for Economic Co-operation and Development). Saat ini, total ada 146 yurisdiksi yang berkomitmen melaksanakan pertukaran data keuangan, dari jumlah ini 79 yurisdiksi menyatakan siap sebagai partisipan. Pada awalnya, setiap yurisdiksi setuju informasi yang dapat dipertukarkan hanya rekening keuangan si wajib pajak. Informasi rekening meliputi identitas pemilik rekening, identitas rekening, identitas lembaga keuangan, saldo akhir rekening, dan pendapatan atau penghasilan pemilik rekening. Cakupan AEoI lalu diperluas menyentuh pemungutan atau pemotongan pajak oleh pihak ketiga di dalam maupun luar negeri, plus keterangan dokumen per negara (Country by Country Report/CbCR). Alhasil, Ditjen Pajak Kemenkeu lebih leluasa menghimpun profil wajib pajak termasuk WP Indonesia yang mendapatkan pendapatan dari luar negeri. Senada dengan BNI, PT Bank Tabungan Pensiuan Nasional Tbk. (BTPN) mengutarakan bahwa sekalipun cakupan data di dalam AEoI diperluas tetapi perseroan yakin takkan mengganggu penghimpunan dana pihak ketiga (DPK). Direktur Keuangan dan Dana BTPN Arief Harris Tandjung menyatakan, dampak pertukaran informasi keuangan antarnegara terhadap kinerja bank tidak seberapa. “Sosialisasinya juga sudah cukup lama. Kekhawatiran nasabah awalnya ada tapi sekarang semua sudah mendapatkan info yang cukup,” ujarnya. Pelaksanaan AEoI antarnegara bertujuan supaya pemerintah lebih leluasa melacak potensi pajak di luar negeri. Sistem ini memungkinkan dilakukan pertukaran informasi rekening WP lintas negara.","Bank Ramal Nasabah Resah soal Keterbukaan Data tapi Cuma Sementara","http://katadata.co.id/berita/2018/08/28/bank-ramal-nasabah-resah-soal-keterbukaan-data-tapi-cuma-sementara"
"Bank-bank milik negara (BUMN) siap bersinergi menjalankan rencana Otoritas Jasa Keuangan (OJK) untuk melonggarkan kredit kepada pengembang properti yang hendak membeli lahan untuk mendirikan area hunian. Sekretaris Himpunan Bank Milik Negara (Himbara) Budi Satria mengatakan, Himbara menyambut baik kebijakan OJK tersebut. Perbankan berharap pertumbuhan kredit konstruksi maupun konsumsi di sektor properti bisa terpacu. ""Kredit konstruksi ujungnya untuk penyediaan properti (melalui) KPR. Kami tidak hanya jamin dari sisi permintaan (perumahan) tetapi juga dari sisi suplai,"" tuturnya, di Jakarta, Senin (13/8).   Budi menjelaskan, melalui pelonggaran penyaluran kredit untuk  maka para pengembang bisa memperoleh pendanaan bank meskipun proyek hunian belum masuk tahap pembangunan. Sekitar 30% dari total kredit yang disetujui bank dapat segera dicairkan.     Namun, kebijakan OJK ini tidak berlaku untuk semua pengembang properti. Otoritas akan menelaah lebih jauh skala bisnis si  Para pengembang perumahan skala kecil yang diprioritaskan untuk mengakses pelonggaran kredit ini. Himbara menilai bahwa pengembang properti skala kecil tidak selalu memiliki profil risiko kredit yang tinggi. Terdapat sejumlah  kecil yang profil risiko kreditnya relatif terjaga. ""Bank tetap lihat kinerjanya, bukan hanya besar kecil (skala usaha). Selama usahanya lancar, kami berikan yang maksimal,” kata Budi. Himbara berharap relaksasi kredit konstruksi properti dibarengi dengan penurunan Aktiva Tertimbang Menurut Risiko. ATMR untuk kredit properti sekarang rerata 35%. Persentase ini diharapkan bisa ditekan ke kisaran 20% seperti Kredit Usaha Rakyat (KUR). Sementara itu, Ketua Dewan Komisioner OJK Wimboh Santoso sebelumnya menuturkan, insentif kredit kepada pengembang semacam ini diharapkan dapat memperkuat dorongan terhadap pertumbuhan bisnis properti. Apalagi, Bank Indonesia (BI) juga merilis relaksasi  (LTV). OJK sejatinya hendak mengikis  alias kesenjangan di antara jumlah rumah terbangun dengan jumlah yang dibutuhkan rakyat. “Kalau   kurang akhirnya orang butuh rumah terutama yang keluarga-keluarga baru, mereka tidak bisa dapat rumah. Kalaupun dapat tapi harganya mahal,” kata dia.","Bank-bank BUMN Siap Longgarkan Kredit untuk Pengembang Properti","http://katadata.co.id/berita/2018/08/14/bank-bank-bumn-siap-longgarkan-kredit-untuk-pengembang-properti"
"Kementerian Pekerjaan Umum dan Perumahan Rakyat (PUPR) akan memperketat pengawasan atas kinerja bank pelaksana Fasilitas Likuiditas Pembiayaan Perumahan mulai Oktober 2018. Budi Hartono selaku Direktur Utama Pengelolaan Dana Pembiayaan Perumahan Kementerian PUPR mengatakan, langkah tersebut bertujuan mengoptimalkan penyaluran dana melalui skema Fasilitas Likuiditas Pembiayaan Perumahan (FLPP). ""Kami akan melakukan evaluasi dan melakukan penyesuaian target jika bank pelaksana FLPP tidak mencapai komitmen yang telah disepakati di dalam perjanjian kerja sama operasi,"" katanya, di Jakarta, Selasa (14/8). Kementerian PUPR melalui Pusat Pengelolaan Dana Pembiayaan Perumahan (PPDPP) melakukan perubahan Perjanjian Kerja Sama Operasi (PKO) dengan 39 bank pelaksana FLPP. Disahkan pula PKO baru dengan empat bank, yaitu PT Bank Tabungan Negara (Persero) Tbk., unit usaha syariah (UUS) BTN, PT Bank KEB Hana Indonesia, dan PT Bank Rakyat Indonesia Agroniaga Tbk.     Dirjen Pembiayaan Perumahan Kementerian PUPR Lana Winayanti mengatakan, jumlah keseluruhan bank pelaksana FLPP pada tahun ini mencapai 43, terdiri dari sebelas bank umum nasional dan 32 lainnya merupakan bank pembangunan daerah (BPD). ""Pemerintah menyediakan alternatif pembiayaan untuk perbankan melalui Sarana Multigriya Finansial yang menyediakan   murah kepada bank pelaksana,"" ujarnya. Lana menjelaskan, PT Sarana Multigriya Finansial (Persero) atau SMF hadir untuk membantu bank pelaksana FLPP yang membutuhkan dana jangka menengah maupun panjang. Saat ini, terdapat 21 bank yang bekerja sama dengan perseroan. Direktur Utama SMF Ananta Wiogo mengatakan, program kredit pemilikan rumah (KPR) dengan suku bunga tetap yang difasilitasi perseroan diharapkan bisa mengatasi   dalam penyaluran KPR berskema FLPP. ""Kami optimistis dengan adanya sinergi yang kuat, program sejuta rumah dapat tercapai dan memberikan kontribusi luar biasa bagi perekonomian Indonesia,"" tuturnya. Sejak awal tahun ini sampai dengan 9 Agustus, FLPP dimanfaatkan untuk mendanai pemilikan 12.885 unit rumah, jumlah ini setara dengan Rp 1,48 triliun. Kementerian PUPR mengubah proporsi pembiayaan di dalam skema FLPP menjadi 75% dari pemerintah dan 25% lainnya oleh bank. Hal ini tertuang di dalam Keputusan Menteri (Kepmen) PUPR No. 463/2018 tentang Proporsi Kredit atau Pembiayaan Pemilikan Rumah Sejahtera. Regulasi tersebut berlaku mulai 20 Agustus 2018. Pertimbangan pemerintah ialah hendak mengurangi beban fiskal serta mendorong bertambahnya populasi rumah bersubsidi.","Mulai Oktober, Bank Penyalur Pembiayaan Rumah Dievaluasi Rutin","http://katadata.co.id/berita/2018/08/14/mulai-oktober-2018-bank-pelaksana-flpp-dievaluasi-rutin"
"PT Bank Tabungan Negara (Persero) Tbk tengah mengkaji opsi  penerbitan obligasi subordinasi dan penerbitan saham baru pada 2020. Hal itu dilakukan untuk menjaga rasio kecukupan modal   di level 14%. ""Sekarang itu (kecukupan) modal masih di 17,4%. Kami harus jaga di 14% berdasarkan peraturan Bank Indonesia (BI). Jadi, saya pikir tahun ini (permodalan) tidak ada masalah, tahun depan juga tidak ada masalah,"" kata Direktur Finance & Treasury Bank BTN Iman Nugroho Soeko di Kementerian PUPR, Jakarta, Selasa (14/8). Iman mengatakan, untuk penerbitan obligasi subordinasi, perseroan mengincar dana segar sekitar Rp 2 triliun hingga Rp 3 triliun. Sedangkan, dari  , perseroan memperkirakan kebutuhan dana mencapai sekitar  Rp 3 triliun hingga Rp 5 triliun. (Baca :  ) Kendati masih berupa rencana, menurut Iman, perusahaan akan mulai melakukan mempersiapkan aksi korporasi tersebut pada tahun depan. Dengan begitu, skema pendanaan tersebut  baru bisa terealisasi pada  2020. ""Akan kita lihat perkembangan dari situasi. Tapi jika kami melihat trend bunga bakal naik, secepatnya kami kerjakan, "" kata Iman. Untuk merealisasikan rencana tersebut, perusahaan milik negara ini harus mendapatkan restu dari pemerintah dan Dewan Perwakilan Rakyat (DPR).  Namun, dengan adanya holding BUMN sektor perbankan, penerbitan   nantinya tak perlu lagi harus mendapat izin DPR. (Baca juga:  ) ""Kami berharap holding-nya jadi, sehingga prosesnya lebih mudah,"" kata Iman. Kementerian BUMN terus menggenjot pembentukan holding perbankan dan jasa keuangan yang antara lain mencakup sejumlah perbankan milik negara (Himbara), Danareksa, Pegadaian, hingga Permodalan Nasional Madani. Kementerian BUMN menyatakan proses pembentukan holding perbankan masih terus bergulir. Pihak kementerian menyatakan masih terus melakukan pembicaraan dengan pihak-pihak terkait.","Butuh Modal, BTN Kaji Terbitkan Obligasi dan Jual Saham Baru pada 2020","http://katadata.co.id/berita/2018/08/14/butuh-modal-btn-kaji-terbitkan-obligasi-dan-jual-saham-baru-pada-2020"
"Otoritas Jasa Keuangan (OJK) meluncurkan Paket Kebijakan Agustus 2018 yang melonggarkan penyaluran kredit untuk sektor perumahan, usaha mikro, kecil, dan menengah (UMKM) yang berorientasi ekspor, dan pariwisata. Kebijakan ini diharapkan dapat menjaga stabilitas sistem keuangan, menambah devisa negara, dan mendorong pertumbuhan ekonomi. Ketua Dewan Komisioner OJK Wimboh Hardjito mengatakan paket kebijakan ini sudah disiapkan sejak lama. Tujuannya untuk meningkatkan peran perbankan, lembaga pembiayaan, dan pasar modal dalam membiayai sektor sektor-sektor produktif yang memicu   bagi sektor riil, ekspor, dan penguatan cadangan devisa. ""Beberapa indikator sektor keuangan masih normal, baik permodalan bank maupun likuiditas bank dan industri jasa keuangan. Kami mendorong industri jasa keuangan agar ruang geraknya lebih leluasa untuk membiayai sektor yang mendorong ekspor, perumahan, dan pariwisata,"" kata Wimboh dalam konferensi pers, di Jakarta, Rabu (15/8). Dampak dari paket kebijakan ini diprediksi sudah bisa dirasakan pada tahun depan. Sektor Perbankan OJK menyiapkan tujuh Peraturan Otoritas Jasa Keuangan (POJK). Pertama, POJK akan mencabut pembatasan kredit bank umum untuk pengadaan tanah. ""Kredit untuk pengadaan tanah yang khusus untuk pembangunan rumah tapak atau rumah susun dan bukan di kawasan komersial diperbolehkan,"" ujar Kepala Eksekutif Pengawas Perbankan OJK Heru Kristiyana. Namun, pengembang yang mengambil kredit ini harus memulai pembangunan proyek perumahan tersebut dalam waktu satu tahun. Jika lewat dari ketentuan tersebut, pengembang akan dikenai sanksi atau diwajibkan melunasi kredit yang diambilnya. POJK perbankan yang kedua akan melonggarkan Batas Maksimum Penyaluran Kredit (BPMK) untuk kredit UMKM yang beragunan rumah tinggal dari maksimal Rp 5 miliar menjadi Rp 10 miliar. Ketentuan ini hanya berlaku untuk UMKM yang berorientasi ekspor.  POJK ketiga mengatur mengenai pelonggaran penyediaan dana kepada Lembaga Pembiayaan Ekspor Indonesia (LPEI) yang dikecualikan dari BMPK dan Batas Maksimum Penyaluran Dana (BMPD). POJK keempat terkait pelonggaran BMPK untuk kredit yang diberikan bank-bank BUMN untuk pembangunan strategis kawasan pariwisata nasional menjadi 30%. Kelima, POJK yang mengatur ekspansi jaringan kantor bank di kawasan pariwisata dikecualikan dari ketentuan minimum modal inti. Keenam, POJK yang mengatur ketentuan minimum untuk pembiayaan ke sektor produktif minimum sebesar 20% dari total portofolio kredit bank. Ketujuh, surat edaran OJK tentang bobot risiko kredit untuk kredit yang beragunan rumah tinggal akan dilakukan secara gradual. Dalam hal ini, pembiayaan perumahan bank umum, bank umum syariah, maupun unit usaha syariah (UUS) akan memiliki aktiva tertimbang menurut risiko (ATMR) yang lebih rendah jika   (LTV) atau   (FTV) lebih besar. (Baca:  ) Pasar Modal dan Multifinance Di sektor pasar modal, OJK mendorong pengembangan perusahaan efek di daerah untuk menjaga kepercayaan investor. OJK juga mendukung diterbitkannya instrumen yang beragam untuk mendukung pendanaan di berbagai sektor yang berorientasi ekspor maupun substitusi ekspor. ""Contohnya dengan menerbitkan Reksadana Penyertaan Terbatas (RDPT), Dana Investasi Infrastruktur (DINFRA), Efek Beragun Aset (EBA),  , dan  ,"" kata Heru. OJK juga akan menyiapkan peraturan untuk penawaran umum emiten skala kecil dan menengah maupun pembiayaan UMKM melalui   alias penawaran saham melalui mekanisme urun dana. Kepala Eksekutif Pengawas Industri Keuangan Non Bank (IKNB) OJK Riswinandi menambahkan, untuk pembiayaan perumahan yang dilakukan oleh perusahaan pembiayaan ( ), OJK juga akan melonggarkan ketentuan uang muka.   yang sehat dengan rasio pembiayaan bermasalah ( /NPF) di bawah 1% hingga maksimal 1% boleh menyalurkan pembiayaan perumahan dengan uang muka nol persen. ""Tentunya ada persyaratan lainnya, misalnya  -nya juga tidak boleh melebihi 10%,"" ujarnya. (Baca:  )","Paket Kebijakan OJK, Obat Kuat Pendorong Perekonomian ","http://katadata.co.id/berita/2018/08/15/paket-kebijakan-ojk-obat-kuat-pendorong-perekonomian"
"PT Bank Mandiri (Persero) Tbk. menargetkan perolehan Rp3 triliun dari penerbitan obligasi yang menjadi bagian dari Penawaran Umum Berkelanjutan (PUB) I tahap ketiga pada tahun ini. Direktur Treasury dan International Banking Bank Mandiri Darmawan Junaidi menyatakan, PUB I tahap ketiga tersebut bagian dari PUB I perseroan dengan total  sebesar Rp14 triliun. Penerbitan obligasi tersebut ditujukan untuk memperkuat struktur pendanaan serta ekspansi kredit perusahaan. “Kami menunjuk enam perusahaan penjamin emisi,” katanya melalui siaran pers yang diterima  , Rabu (8/8). Para penjamin emisi yang dimaksud adalah Mandiri Sekuritas, Bahana Sekuritas, BCA Sekuritas, BNI Sekuritas, Danareksa Sekuritas, dan Trimegah Sekuritas. (Baca juga:  ) PUB I tahap ketiga ini akan diterbitkan Bank Mandiri dengan tenor 5 tahun. Adapun, kupon berkisar 7,75% - 8,50%. Penawaran awal berlangsung pada 8 – 24 Agustus 2018 sedangkan penawaran umumnya diperkirakan pada 14 – 17 September 2018. Pada 2016 dan 2017, emiten berkode saham BMRI ini menerbitkan obligasi senilai total Rp11 triliun yang terbagi menjadi dua tahap. Pada PUB I tahap pertama pada 2016, perseroan menerbitkan obligasi Rp5 triliun kemudian pada PUB I tahap kedua tahun lalu senilai Rp6 triliun.","Bank Mandiri Jual Obligasi Rp 3 Triliun untuk Ekspansi Kredit","http://katadata.co.id/berita/2018/08/08/bank-mandiri-jual-obligasi-rp-3-triliun-untuk-ekspansi-kredit"
"Penyaluran Kredit Usaha Rakyat ( ) berpotensi mencapai Rp 123,53 triliun, atau melebihi target tahun ini yang sebesar Rp 120 triliun. Penyebabnya, perbankan meminta penambahan plafon yang cukup besar seiring tingginya permintaan dari Usaha Mikro, Kecil, dan Menengah (UMKM). Kementerian Koordinator Bidang Perekonomian mencatat, sebelumnya, plafon KUR yang sudah dialokasikan ke perbankan sebesar Rp 117,08 triliun dari target Rp 120 triliun. Artinya, masih tersisa Rp 2,92 triliun yang belum dialokasikan. Namun belakangan, perbankan mengajukan penambahan plafon melebihi angka tersebut dan disetujui pemerintah.  “Bank mengajukan tambahan plafon Rp 6,46 triliun sehingga plafon KUR menjadi Rp 123,53 triliun,” kata Deputi Bidang Koordinasi Ekonomi Makro dan Keuangan Kemenko Perekonomian Iskandar Simorangkir di kantornya, Jakarta, Rabu (8/8). Dengan demikian, penyaluran KUR berpotensi melebihi target. (Baca juga:  ) Menurut dia, penambahan plafon tersebut disetujui pemerintah dengan memperhatikan rekomendasi dari Otoritas Jasa Keuangan (OJK). Harapannya, penambahan tersebut dapat membantu UMKM dalam mengakses kredit dengan suku bunga yang terjangkau. Meski terdapat penambahan plafon KUR, subsidi bunga yang ditanggung pemerintah tidak berubah, yaitu untuk KUR mikro sebesar 10,5% dari suku bunga pasar yang sebesar 17,5% per tahun. Dengan begitu, suku bunga KUR mikro berada di level 7% per tahun. Sementara itu, subsidi bunga yang ditanggung pemerintah untuk KUR kecil sebesar 5,5% per tahun. Berdasarkan data realisasi KUR sepanjang 2015 sampai pertengahan 2018, total penyaluran KUR telah mencapai Rp 277,4 Triliun. Dari jumlah tersebut baki debet ( ) tercatat sebesar Rp Rp 130,8 Triliun untuk 11,8 juta pelaku UMKM. Adapun tingkat kredit seret atau   (NPL) KUR tercatat rendah yaitu sebesar 1,06%. Secara khusus, sepanjang paruh pertama tahun ini, total penyaluran KUR telah mencapai Rp 64,6 triliun atau 55,2% dari plafon sebelumnya yang sebesar Rp 117,08 triliun. Adapun rasio NPL tercatat rendah yaitu sebesar 0,01%. Sementara itu, porsi terbesar KUR masih untuk usaha mikro. Rinciannya, dari total RP 64,6 triliun, sebanyak Rp 41 triliun (63,5%) mengalir untuk usaha mikro, lalu sebesar Rp 23,3 triliun (36,1%) untuk usaha kecil, dan sebesar Rp 231 miliar (0,4%) untuk penempatan Tenaga Kerja Indonesia (TKI). Jika dilihat menurut wilayah, penyaluran KUR terbanyak masih untuk UMKM di Pulau Jawa yaitu sebesar 54,9%, lalu diikuti Sumatera 19,4%, Sulawesi 10%, Bali dan Nusa Tenggara 7,1%, kemudian Kalimantan 6,4%, serta Maluku dan Papua 2,2%. Tahun depan, pemerintah menargetkan penyaluran KUR naik menjadi Rp 140 triliun dengan bunga KUR mikro direncanakan tetap yaitu 7% per tahun. “Kalau kuotanya sudah habis, kami akan setop, tidak dikasih lagi,” ujarnya.","Permintaan Tinggi, Penyaluran Kredit Rakyat Bisa Tembus Rp 123 Triliun","http://katadata.co.id/berita/2018/08/08/permintaan-tinggi-penyaluran-kredit-rakyat-bisa-tembus-rp-123-triliun"
