"article","title","url"
"Setelah Bank Indonesia mengerek   BI 7 Days Repo sebanyak tiga kali dalam dua bulan hingga 100 basis poin ke level 5,25 %, kalangan perbankan mulai mengikuti langkah bank sentral tersebut. Selain deposito, bunga kredit pun makin merayap naik. Deputi Gubernur Senior Mirza Adityaswara mengatakan peningkatan bunga disebabkan oleh penyesuaian pada kebijakan BI tadi. “BI melihat perkembangan ini merupakan   untuk menghadapi gejolak global. BI melakukan penyesuaian suku bunga,” kata Mirza di kantornya, Jakarta, Jumat (27/7).  Menurut Mirza, pada Juli ini bunga deposito rata-rata sebesar 5,71 %. Posisi tersebut naik 15 basis poin dibandingkan rata-rata bunga deposito perbankan sebesar 5,56 %. (Baca:  ) Tak hanya deposito, perbankan otomatis mengerek bunga kreditnya. Untuk bunga kredit modal kerja sebesar 12,13 % pada bulan ini. Angka tersebut naik 16 basis poin dibandingkan rata-rata kredit modal kerja pada Juni kemarin sebesar 11,97 %. Walau industri perbankan mulai menaikkan imbal hasil pinjamannya, Mirza menilai penyesuaian tersebut masih dalam batas wajar. “Ini hal yang baik, kenaikan tidak drastis,” ujarnya.  Meski ada kenaikan, kredit tetap tumbuh. Laproan Harian Bank Umum (LHBU) BI mencatat pertumbuhan kredit hingga 0,12 % pada minggu ketiga Juli 2018. Bila dihitung dari awal tahun hingga pekan ketiga kemarin, kenaikannya 4,65 %. Adapun bila dibandingkan tahun lalu, kredit naik 11,3 %. Sebelumnya, Gubernur BI Perry Warjiyo memastikan likuiditas saat ini tetap aman. Dengan begitu, perbankan tak perlu menaikkan bunga deposito untuk menarik dana pihak ketiga (DPK), yang biasanya diikuti dengan bunga kredit. Menurut Perry, kenaikan bunga acuan tidak perlu diikuti bunga perbankan, sebab likuiditas lebih dari cukup. (Lihat pula:  ). Sebenarnya, gelagat perbankan hendak menaikkan bunga sudah terlihat sejak akhir Mei lalu. Ketika itu mereka mulai mengevaluasi bunga deposito dan kredit. Hal itu menyusul dua kali kenaikan   BI 7 Days Repo Rate dengan total 0,5% pada Mei 2018. Bank swasta terbesar di Indonesia, Bank Central Asia (BCA), sudah menaikkan bunga depositonya. Direktur BCA Henry Khoenafi menjelaskan meski bunga deposito naik, namun bunga kredit masih dipertahankan. “Belum ada rencana penyesuaian bunga kredit, sedangkan deposito kami sudah naikkan 0,25%,” kata dia kepada  , Kamis (31/5). Sementara itu, Direktur Utama Bank BTN Maryono menilai kenaikan bunga acuan pertama yaitu 0,25% di pertengahan Mei lalu tak berpengaruh besar ke pasar sehingga belum ada penyesuaian. Namun, lantaran adanya kenaikan lanjutan, pihaknya perlu mengkaji lebih lanjut. “Belum bisa melihat apakah kami akan menaikkan suku bunga dana dan kemudian diikuti dengan kenaikan suku bunga kredit. Saya akan minta pendapat dari ekonom kami, bagaimana perkiraan market di pasar,"" kata Maryono ketika itu.","Bank Ramai-ramai Mulai Menaikkan Bunga Kredit dan Deposito","http://katadata.co.id/berita/2018/07/27/bank-ramai-ramai-mulai-menaikkan-bunga-kredit-dan-deposito"
"Tiket   dijual bersama asuransi kecelakaan. PT Pison Tickettech (KiosTix) menggandeng PT Mandiri AXA General Insurance (MAGI) dalam hal keamanan penonton yang menyaksikan Asian Games 2018. Melalui kerja sama ini, penonton memperoleh benefit berupa asuransi senilai Rp 10 juta per orang. Manfaat itu diberikan kepada penonton yang mengalami kecelakaan yang menyebabkan meninggal dunia atau cacat tetap total. ""Kecelakaan yang dicover jika terjadi di dalam gedung sejak dua jam sebelum, hingga dua jam sesudah acara,"" ujar Presiden Direktur MAGI Paul Henri Rastoul saat konferensi pers di kantornya, Jakarta, Jumat (27/7). Biaya asuransi yang dibayarkan senilai Rp 1.000 telah termasuk dalam harga tiket Asian Games 2018. Sementara, panitia menargetkan 2 juta tiket akan terjual dalam ajang 4 tahunan ini. ""Saya kira, Presiden Joko Widodo sangat tertarik dengan literasi dan inklusi keuangan. Asian Games 2018 ini peluang bagi kami,"" ujar Paul. Untuk mengajukan klaim asuransi ini, penonton bisa mendatangi   KiosTix atau melalui layanan MAGI baik situs resmi ataupun aplikasi percakapan. Nantinya, tim dari MAGI akan meninjau klaim yang diajukan hingga akhirnya menyetujui pemberian benefit. Dalam kerja sama ini, MAGI juga bekerja sama dengan Indonesian Asian Games Organizing Committee (Inasgoc), menyediakan asuransi bagi para atlet. (Baca juga:  ) CEO KiosTix Ade Sulistioputra optimistis, kerja sama ini dapat mendorong minat masyarakat untuk membeli tiket Asian Games 2018. Sebab, benefit yang dihadirkan cukup banyak. ""Siapapun yang punya tiket, otomatis terdaftar asuransinya,"" kata dia. Adapun tiket Asian Games 2018 sudah bisa dibeli sejak 30 Juni 2018. Ade mengklaim, antusiasme masyarakat untuk membeli tiket perhelatan olahraga terbesar di Asia ini cukup tinggi. Hanya saja, ia masih enggan menyampaikan besaran penjualannya. ""Progresnya sangat bagus. Tapi, biasanya orang menunggu atlet Indonesia main dulu kan,"" ujarnya. Untuk acara pembukaan Asian Games 2018 di Stadion Utama Gelora Bung Karno (GBK) pada 18 Agustus 2018, dengan harga tiket antara Rp 750 ribu hingga Rp 5 juta. Sedangkan untuk penutupan pada 2 September 2018 di lokasi yang sama, harga tiketnya antara Rp 450 ribu hingga Rp 2 juta. Sementara harga tiket untuk tiap pertandingan dijual antara Rp 50 – 800 ribu. Harga tiket yang ditetapkan berbeda untuk tiap cabang olah raga dan babak. Saat ini, seluruh jadwal dan harga tiket untuk tiap pertandingan sudah bisa diakses melalui Kiostix.com.","Tiket Asian Games 2018 Dijual Bersama Premi Asuransi Mandiri AXA","http://katadata.co.id/berita/2018/07/27/tiket-asian-games-2018-dijual-bersama-premi-asuransi-mandiri-axa"
"Bunga deposito valuta asing (valas) tercatat terus meningkat. Perbankan berharap kenaikan tersebut bakal membuat pemilik valas, termasuk eksportir, lebih tertarik menempatkan dananya di perbankan domestik. Bahkan, sudah ada perbankan yang menawarkan bunga valas nyaris 3% per tahun untuk deposito berjumlah besar. Mengacu pada data Statistik Perbankan Indonesia per Mei,   bank umum terus bergerak naik sejak tahun lalu, berbanding terbalik dengan bunga deposito rupiah yang ketika itu cenderung turun. Per Mei, bunga deposito valas untuk jangka 1 bulan tercatat sebesar 1,35%, jauh di atas bulan yang sama tahun lalu yaitu 0,95%. Sementara itu, untuk deposito valas jangka 3 bulan, bunganya sebesar 1,86%, juga di atas bulan yang sama tahun lalu 1,34%. Lalu, untuk jangka 6 bulan, bunganya sebesar 1,76%, di atas bulan yang sama tahun lalu 1,6%. Terakhir, untuk jangka 1 tahun ke atas, bunganya sebesar 1,47%, juga melebihi bulan yang sama tahun lalu 1,25%. Direktur Utama PT Bank Mandiri (Persero) Tbk Kartika Wirjoatmodjo mengatakan, pihaknya bahkan sudah memberikan bunga deposito di kisaran 2,5-2,75% untuk deposito valas jumlah besar, jauh di atas sebelumnya di kisaran 0,75%. “Sudah per dua minggu yang lalu. Tapi enggak di   ya. Ini  ,” ucapnya di Kantor Kementerian Koordinator bidang Kemaritiman, Jakarta pada Senin (30/7). (Baca juga:  ) Ia menjelaskan, kenaikan bunga tersebut merupakan salah satu strategi untuk menarik pelaku usaha agar menempatkan valasnya dalam deposito di Bank Mandiri. Sebab, pelaku usaha pasti membandingkan  penempatan valas di berbagai instrumen, di dalam dan di luar negeri, untuk meraup keuntungan terbaik. Menurut dia, potensi   yang bisa diserap bank-bank pelat merah cukup besar yaitu mencapai US$ 500 juta per bulan. “Masalahnya tadi, mereka selalu membandingkan dengan total   mereka kalau mereka taruh di  ,” ujarnya. Lebih jauh, untuk meningkatkan daya tarik penempatan valas di dalam negeri, ia menyebut pentingnya instrumen-instrumen guna membuat pelaku usaha yakin bahwa “ ” yang diperoleh dari deposito sesuai dengan harapan mereka. “Karena memang sekarang dengan volatilitas seperti ini. Saya lihat memang banyak eksportir yang mulai   jual.  memang harus ada kepastian jual masa depan,” kata dia. Adapun upaya mendorong pasokan valas juga tengah menjadi fokus pemerintah. Tujuannya, untuk membantu stabilisasi nilai tukar rupiah terhadap dolar Amerika Serikat (AS). Bahkan, pekan lalu, Presiden Joko Widodo bersama para menteri ekonomi-nya menggelar pertemuan khusus dengan para taipan untuk mengimbau pemulangan dan konversi devisa hasil ekspor ke rupiah. Pemerintah mencatat ada sekitar 15% devisa hasil ekspor yang tak masuk ke Indonesia, sementara hitungan BI sekitar 10%. Padahal, ada ketentuan BI yang mewajibkan devisa tersebut diparkir di bank devisa dalam negeri, meski tak ada ketentuan batas minimal waktu penyimpanan.  (Baca juga:  ) Mengacu pada data BI, sepanjang Januari hingga Mei tahun ini, nilai ekspor untuk keseluruhan mata uang mencapai US$ 75,11 miliar, sedangkan untuk yang transaksinya dalam dolar AS mencapai US$ 70,93 miliar.","Bidik Devisa Hasil Ekspor, Perbankan Kerek Tinggi Bunga Deposito Valas","http://katadata.co.id/berita/2018/07/30/bidik-devisa-hasil-ekspor-perbankan-kerek-tinggi-bunga-deposito-valas"
"Otoritas Jasa Keuangan (OJK) sudah memberikan restu kepada Bank of Tokyo-Mitsubishi UFJ Limited (MUFG) untuk meningkatkan kepemilikan saham di PT   Tbk. menjadi 40% sehingga menjadi pemegang saham pengendali. Seiring publikasi mengenai restu tersebut, harga saham Bank Danamon melonjak. MUFG berencana mengakuisisi sebanyak 73,8% saham Bank Danamon yang dipegang Asia Financial (Indonesia) Pte. Ltd. (AFI) dan entitas terafiliasi lainnya. Akuisisi dilakukan dalam tiga tahap. Akuisisi tahap pertama, yaitu sebesar 19,9% sudah selesai. Selanjutnya, setelah mengantongi restu OJK, MUFG bakal melakukan akuisisi tahap kedua yaitu sebanyak 20,1% sehingga total kepemilikannya menjadi 40%. Mengacu pada data , harga saham Bank Danamon langsung melesat setelah informasi soal restu OJK tersebut dipublikasikan. Harga saham bank berkode bursa BDMN tersebut sempat mencapai 6.950 pada perdagangan Selasa (31/7) siang atau melonjak 11,2% dari penutupan sehari sebelumnya. Namun, berangsur turun hingga ditutup di level 6.575 atau naik 5,2% dari penutupan sehari sebelumnya. (Baca juga:  ) Pihak Bank Danamon menyatakan peralihan kepemilikan saham tidak akan membuat fokus bisnis bank berubah. ""Kami tetap berkomitmen menjalankan strategi perusahaan. Layanan dan kegiatan operasional perbankan tetap berjalan seperti biasa,"" seperti dikutip dari keterangan resmi Bank Danamon, Selasa (31/7). Adapun Bank Danamon bakal membutuhkan restu lanjutan dari OJK untuk meningkatkan kepemilikan menjadi 73,8%. Sebab, lembaga keuangan sebetulnya hanya bisa mengakuisi maksimal 40% saham bank umum. Hal itu berdasarkan Peraturan OJK Nomor 56/POJK.03.2016 tentang kepemilikan saham bank umum. Secara rinci, lembaga keuangan hanya bisa memiliki saham bank umum maksimal 40%, sedangkan lembaga keuangan non-bank maksimal 30%, dan perorangan maksimal 20%. Lembaga keuangan bisa memiliki saham lebih dari ketentuan tersebut dengan persetujuan OJK. Ada beberapa syarat yang harus dipenuhi lembaga keuangan bila ingin menguasai lebih dari 40% saham bank umum, antara lain, tingkat kesehatan yang baik, berbentuk perusahaan terbuka, dan berkomitmen untuk memiliki bank dalam jangka waktu tertentu, dan mendukung pengembangan perekonomian Indonesia.","OJK Restui Bank of Tokyo Jadi Pengendali, Harga Saham Danamon Melonjak","http://katadata.co.id/berita/2018/07/31/ojk-restui-bank-of-tokyo-jadi-pengendali-harga-saham-danamon-melonjak"
"Bank Permata berencana menurunkan persentase   atau   (DP) dalam penyaluran Kredit Pemilikan Rumah (KPR). Hal ini terkait penerapan relaksasi aturan batas kredit yang diberikan perbankan terhadap nilai agunan atau    (LTV), yang resmi berlaku mulai kemarin. Direktur Utama Bank Permata Ridha DM Wirakusumah mengatakan dengan adanya relaksasi ini, Bank Permata akan menurunkan sedikit persentase DP untuk rumah pertama menjadi 10% hingga 14%. Sebelumnya, bank ini menerapkan batas minimal DP KPR sebesar 15%. ""Pemerintah sudah melonggarkan, tapi kami memang sudah mengarah ke sana (mengurangi  DP KPR). Pemerintah   ke situ, kami akan ikut dan lebih proaktif,"" katanya di Jakarta pada Rabu (1/8). (Baca:  ) Pengurangan uang muka ini hanya dilakukan untuk KPR konvensional. Sementara untuk KPR Syariah, ketentuannya masih tetap. Alasannya, saat ini Bank Permata sudah memberikan ketentuan DP untuk KPR Syariah sebesar 10%. Dia mengatakan masyarakat bisa memilih menggunakan KPR Syariah Bank Permata, karena uang muka dan bunganya yang rendah. Menurutnya, bisnis sektor perumahan sangat bagus sekarang. Terutama di DKI Jakarta yang separuh warganya belum memiliki rumah. Untuk penyaluran KPR, Bank Permata akan menyasar semua lapisan masyarakat. Tidak hanya kalangan menengah ke atas, tapi akan mulai menyasar masyarakat menengah ke bawah. (Baca:  Saat ini Bank Permata sedang menggodok suatu formula bersama perusahaan plat merah yang bergerak di bidang properti, yaitu PT PP Properti. Kerja sama ini dilakukan untuk meningkatkan penyaluran KPR bagi kalangan menengah ke bawah di seluruh Indonesia. Meski begitu, formula yang dirancang bukanlah dengan menerapkan uang muka KPR 0%. Dia menilai pemberian DP 0% cukup berisiko bagi penyaluran kredit. Apalagi Bank Permata sedang berjuang untuk memperbaiki kualitas kredit seret alias Non-Performing Loan (NPL) yang masih tinggi. Pada Mei lalu, posisi NPL Bank Permata mencapai 4,5% hingga 4,6%. ""Tapi ini sudah lebih bagus dari yang dulu-dulu,"" kata Ridha. Seperti diketahui, Bank Indonesia mulai memberlakukan kebijakan relaksasi LTV pada 1 Agustus 2018.  Relaksasi ini sebagai perangsang pertumbuhan kredit perbankan, karena suku bunga acuan BI 7 Days Repo Rate dinaikan. Kebijakan LTV kali ini membebaskan bank untuk menetapkan besaran DP untuk KPR. (Baca:  )","Bank Permata Akan Turunkan Uang Muka KPR Sebesar 5%","http://katadata.co.id/berita/2018/08/02/bank-permata-akan-turunkan-uang-muka-kpr-sebesar-5"
"Penerbitan surat utang korporasi pada semester I 2018 mencapai Rp 75,28 triliun dari 55 perusahaan, meningkat 32% dibandingkan dengan periode yang sama tahun lalu. Perusahaan pembiayaan ( ) dan perbankan tetap mendominasi penerbitan surat utang dengan porsi sebesar 64,16% atau Rp 48,3 triliun. Menurut Senior Vice President Financial Institution Ratings Division PT Pemeringkat Efek Indonesia (Pefindo) Hendro Utomo, perusahaan kertas ( ) menjadi penerbit surat utang terbesar ketiga dengan nilai Rp 7,32 triliun. Perusahaan di sektor konstruksi berada di urutan keempat dan kelima, masing-masing dengan surat utang yang diterbitkan sebesar Rp 3,7 triliun dan Rp 3,23 triliun. Jika dilihat berdasarkan jenis surat utang, penerbitan obligasi paling banyak dilakukan oleh korporasi, yakni mencapai Rp 54,96 triliun atau 73%. Penerbitan   (MTN) berada di urutan kedua sebesar Rp 16,2 triliun atau 21,52%. Sisanya adalah penerbitan sekuritisasi aset sebesar Rp 1,82 triliun dan sukuk Rp 2,29 triliun. ""Dari total industri, pemeringkatan yang dilakukan Pefindo mencakup 44 perusahaan dengan nilai surat utang yang diterbitkan sebesar Rp 61,36 triliun,"" kata Hendro.   Minat penerbitan surat utang korporasi yang tinggi diprediksi akan berlanjut pada semester II 2018 meskipun akan sedikit melambat jika dibandingkan semester I 2017. Berdasarkan mandat pemeringkatan yang diterima Pefindo, potensi penerbitan surat utang korporasi pada semester II mencapai Rp 65,57 triliun dari 57 perusahaan. (Baca:  ) Rencana penerbitan MTN mendominasi sebesar Rp 24,71 triliun disusul obligasi Rp 10,26 triliun, dan realisasi penawaran umum berkelanjutan (PUB) Rp 13,05 triliun. Selain itu, ada encana penerbitan PUB baru senilai Rp 10,8 triliun, sekuritisasi Rp 4 triliun, dan sukuk Rp 2,75 triliun. Ekonom Pefindo Fikri C Permana mengatakan, kenaikan suku bunga acuan di Amerika Serikat (AS) yang diikuti kenaikan suku bunga acuan Bank Indonesia (BI). Hal ini menyebabkan kenaikan biaya dana. ""Pada awal tahun, kami masih optimis penerbitan surat utang tahun ini akan mencetak rekor baru. Tetapi, kenaikan suku bunga akan membuat penerbitan surat utang korporasi tahun ini sama seperti tahun lalu Rp 180 triliun,"" ujar dia. Pengetatan MTN Hendro menambahkan, proyeksi penerbitan surat utang pada semester II 2018 tersebut juga belum memperhitungkan ketentuan baru dari Otoritas Jasa Keuangan (OJK) yang memperketat penerbitan MTN.  Pasca kasus gagal bayar bunga MTN yang terjadi pada PT Sunprima Nusantara Pembiayaan (SNP Finance) pada Mei lalu, penerbitan MTN akan dikenakan persyaratan yang mirip dengan penerbitan obligasi. Perusahaan harus melakukan penawaran umum, menggunakan jasa penjamin emisi, dan harus mendapatkan izin efektif dari OJK.  Pefindo belum memiliki gambaran apakah aturan baru dari OJK tersebut akan memengaruhi mandat yang telah diterima oleh perusahaan. ""Ketentuan ini bisa berpengaruh dari sisi emiten yang selama ini menjadikan MTN sebagai sumber pendanaan alternatif. Dari sisi investor, bisa saja mereka mengkaji ulang kebijakan mereka untuk berinvestasi di MTN,"" kata Hendro. Perkembangan dari ketentuan ini baru bisa dilihat dalam beberapa kuartal mendatang.   (Baca:  )","Semester I 2018, Penerbitan Surat Utang Korporasi Rp 75,28 Triliun","http://katadata.co.id/berita/2018/07/31/semester-i-2018-penerbitan-surat-utang-korporasi-rp-7528-triliun"
" meluncurkan layanan aplikasi   yang diberi nama Permata Mobile X. Melalui aplikasi ini, perbankan Grup Astra tersebut menargetkan dapat menjaring 2 juta nasabah baru, dalam waktu 2 tahun.  “Sekarang jumlah rekening kami hampir 2 juta nasabah. Kalau bisa sampai 4 juta dalam waktu dua tahun. Kalau bisa lebih cepat,” kata Direktur Utama Bank Permata Ridha DM Wirakusumah usai peluncuran aplikasi ini di Jakarta, Rabu (1/8). Meski menargetkan jumlah nasabahnya naik dua kali lipat, peluncuran aplikasi ini sebenarnya salah satu upaya meningkatkan layanan Bank Permata. Berapa pun jumlah nasabah yang akan terjaring, yang terpenting kemudahan nasabah dalam bertransaksi. (Baca:  ) Ridha mengatakanBank Permata akan terus berinvestasi dalam pengembangan aplikasi ini secara berkelanjutan, dengan menempatkan teknologi yang tepat dan sesuai. Sayangnya, dia tidak mau mengungkapkan berapa besaran nilai investasi untuk pengembangan aplikasi Permata Mobile X. Dia menjelaskan investasi yang dikeluarkan paling besar untuk aplikasi ini bukan di teknologinya, tapi lebih pada sumber daya manusianya (SDM). Menurutnya, dengan teknologi seperti apapun, jika SDM-nya buruk, maka teknologinya tidak akan berkembang. Direktur Teknologi & Operasi Bank Permata Abdy D. Salimin mengatakan Permata Mobile X merupakan penyederhanaan dari kerumitan perbankan dan menghilangkan kebosanan bertransaksi. Makanya, Bank Permata mendesain ulang dan merombak total aplikasi   sebelumnya. “Permata Mobile X menjadi lebih menarik, cepat dan mudah digunakan sebagai aplikasi yang menyenangkan dalam melakukan perbankan digital dan menjadikannya masa depan  ,” katanya. (Baca:  ) Pada salah satu fiturnya, Permata Mobile X dapat melakukan transfer menggunakan nomor telepon seluler (ponsel). Namun, nasabah masih harus mengganti nomor ponselnya pada aplikasi tersebut, apabila bepergian ke luar negeri. “Permata Bank  -nya jadi mandul (kalau di luar negeri),” kata salah satu nasabah Bank Permata yang juga merupakan CEO KapanLagi Youniverse (KLY) Steve Christian. Menurutnya hal ini menjadi pekerjaan rumah yang harus dibereskan Bank Permata kedepannya. Selain dapat melakukan transfer dengan menggunakan nomor ponsel, dengan aplikasi Permata Mobile X, memungkinkan nasabah dapat melihat saldo dengan cepat tanpa   terlebih dahulu. Aplikasi ini juga memiliki kemampuan untuk   dengan cepat melalui WhatsApp, LINE, SMS dan email, sekaligus dapat melihat mutasi rekening di semua akun selama lebih dari 12 bulan. Aplikasi ini juga memungkinkan nasabah membuka rekening giro, tabungan dan deposito berjangka, lalu membeli dan menjual reksadana dan obligasi. (Baca:  )","Luncurkan Aplikasi Mobile, Bank Permata Targetkan 2 Juta Nasabah Baru","http://katadata.co.id/berita/2018/08/01/luncurkan-aplikasi-mobile-bank-permata-targetkan-2-juta-nasabah-baru"
"Hari ini, 2 Agustus 2018, PT Bank Tabungan Pensiunan Tbk. atawa BTPN mengeluarkan keterangan resmi soal rencana penggabungan dirinya dengan PT Bank Sumitomo Mitsui Indonesia atau SMBCI. Tak tanggung-tanggung, apabila merujuk kepada neraca per 31 Mei 2018 maka bank hasil penggabungan kelak diproyeksikan bakal mengantongi aset Rp179 triliun. Angka ini bakal memposisikan BTPN sebagai satu dari sepuluh bank dengan aset terbesar di Indonesia. BTPN dan SMBCI notabene sesama anak usaha dari Sumitomo Mitsui Banking Corporation (SMBC) yang ada di Indonesia. Pada BTPN, SMBC memegang kepemilikan saham sebesar 40% sedangkan di SMBCI jauh lebih dominan mencapai 98,48%. Di dalam siaran persnya, BTPN menyatakan bahwa seluruh dokumen rencana penggabungan hendak diajukan kepada Otoritas Jasa Keuangan (OJK) pada 2 Agustus 2018. Manakala restu regulator sudah keluar barulah BTPN mengajukan persetujuan dari pemegang saham melalui RUPSLB. Direktur Utama BTPN Jerry Eng menyatakan, publikasi resmi yang dirilis perusahaan menandai dimulainya proses penggabungan tersebut. “Penggabungan ini akan melahirkan bank baru yang lebih besar dan kuat, sehingga dapat lebih berperan memenuhi berbagai kebutuhan pembiayaan,” tulis dia. BTPN dan SMBCI jelas bukan pemain baru di dalam industri perbankan. BTPN hadir sejak 16 Februari 1958. Perseroan mengawali karir sebagai bank devisa yang fokus melayani serta memberdayakan para pensiunan, komunitas prasejahtera produktif, serta pelaku usaha mikro, kecil, dan menengah (UMKM). Fokus usaha tersebut didukung enam unit bisnis, yakni BTPN Purna Bakti untuk nasabah pensiunan, BTPN Mitra Usaha Rakyat bagi pebisnis mikro, BTPN Mitra Bisnis untuk UKM, BTPN Sinaya selaku unit bisnis pendanaan, produk Laku Pandai yang dinamai BTPN Wow, serta platform perbankan digital Jenius untuk mengakomodir kebutuhan  . Adapun, layanan untuk nasabah dari komunitas prasejahtera produktif diberikan melalui anak usahanya, BTPN Syariah. Sampai dengan medio tahun ini, BTPN memiliki aset Rp99,9 triliun. Total kredit yang telah disalurkan perseroan mencapai Rp67,8 triliun dengan pendanaan senilai Rp80,3 triliun. Rasio kecukupan modal (capital adequacy ratio / CAR) tercatat 24,1%, sedangkan laba bersih sejumlah Rp1,09 triliun. Sementara itu, SMBCI juga bukan pemain anyar. Bank ini hadir sejak 31 Mei 1989 yang kala itu merupakan bank campuran antara The Sumitomo Bank, Ltd. dan PT Bank Niaga Tbk. Akhirnya, tepat pada 30 November 1999 namanya berubah menjadi PT Bank Sumitomo Indonesia. Setahun kemudian, perseroan mengumumkan penggabungan usaha dengan PT Bank Sakura Swadharma. Efektif terhitung sejak 2 April 2001, Bank Sumitomo menjadi bank yang bertahan lantas ganti nama menjadi PT Bank Sumitomo Mitsui Indonesia. Berbeda dengan BTPN yang lebih sering berkutat dengan nasabah ritel, SMBCI fokus melayani kebutuhan perusahaan berskala besar. Klien-kliennya tak lain perusahaan pelat merah, korporasi multinasional, perusahaan lokal pun ada, dan tentunya korporasi-korporasi Jepang. Selama beberapa tahun terakhir, SMBCI semakin aktif melibatkan diri di dalam berbagai proyek yang pendanaannya berasal dari kredit sindikasi. Perseroan banyak membidik proyek infrastruktur maupun di sektor pendukungnya. Per akhir Mei 2018, SMBCI mengantongi aset sejumlah Rp85,2 triliun. Total kredit yang disalurkan mencapai Rp64,2 triliun. Adapun, profit bersih yang diraup sepanjang Januari – Mei 2018 tercatat Rp360,7 miliar. Jerry optimistis bahwa BTPN dan SMBCI mampu berkolaborasi dengan baik. Para pemegang saham, imbuhnya, setuju untuk mempertahankan nama BTPN. Ke depan, bank hasil penggabungan akan dipacu supaya semakin inovatif dalam mengembangkan layanan perbankan digital. “Penggabungan ini saling melengkapi, baik di dalam produk maupun layanan. Bank [hasil penggabungan] ini akan terus melayani nasabah mulai dari piramida yang terbawah hingga nasabah-nasabah koporasi internasional,” kata Jerry. Penggabungan BTPN dan SMBCI tentu ikut mengubah jajaran manajemen. Wakil Direktur Utama BTPN Ongki Wanadjati Dana disebut-sebut akan menggantikan posisi Jerry Eng yang masa jabatannya habis pada tahun depan. Komisaris Utama BTPN Mari Elka Pangestu turut berkomentar. “Seluruh rencana ini akan dimintakan persetujuan regulator dulu. Jerry akan tetap memimpin BTPN sampai proses penggabungan selesai agar penggantian [pimpinan] tidak mengganggu proses bisnis perusahaan,” tuturnya.","BTPN - SMBCI Merger, Jumlah Bank Besar di Indonesia Bertambah","http://katadata.co.id/berita/2018/08/02/btpn-smbci-merger-populasi-bank-besar-di-tanah-air-bertambah"
