"article","title","url"
"Tiket   dijual bersama asuransi kecelakaan. PT Pison Tickettech (KiosTix) menggandeng PT Mandiri AXA General Insurance (MAGI) dalam hal keamanan penonton yang menyaksikan Asian Games 2018. Melalui kerja sama ini, penonton memperoleh benefit berupa asuransi senilai Rp 10 juta per orang. Manfaat itu diberikan kepada penonton yang mengalami kecelakaan yang menyebabkan meninggal dunia atau cacat tetap total. ""Kecelakaan yang dicover jika terjadi di dalam gedung sejak dua jam sebelum, hingga dua jam sesudah acara,"" ujar Presiden Direktur MAGI Paul Henri Rastoul saat konferensi pers di kantornya, Jakarta, Jumat (27/7). Biaya asuransi yang dibayarkan senilai Rp 1.000 telah termasuk dalam harga tiket Asian Games 2018. Sementara, panitia menargetkan 2 juta tiket akan terjual dalam ajang 4 tahunan ini. ""Saya kira, Presiden Joko Widodo sangat tertarik dengan literasi dan inklusi keuangan. Asian Games 2018 ini peluang bagi kami,"" ujar Paul. Untuk mengajukan klaim asuransi ini, penonton bisa mendatangi   KiosTix atau melalui layanan MAGI baik situs resmi ataupun aplikasi percakapan. Nantinya, tim dari MAGI akan meninjau klaim yang diajukan hingga akhirnya menyetujui pemberian benefit. Dalam kerja sama ini, MAGI juga bekerja sama dengan Indonesian Asian Games Organizing Committee (Inasgoc), menyediakan asuransi bagi para atlet. (Baca juga:  ) CEO KiosTix Ade Sulistioputra optimistis, kerja sama ini dapat mendorong minat masyarakat untuk membeli tiket Asian Games 2018. Sebab, benefit yang dihadirkan cukup banyak. ""Siapapun yang punya tiket, otomatis terdaftar asuransinya,"" kata dia. Adapun tiket Asian Games 2018 sudah bisa dibeli sejak 30 Juni 2018. Ade mengklaim, antusiasme masyarakat untuk membeli tiket perhelatan olahraga terbesar di Asia ini cukup tinggi. Hanya saja, ia masih enggan menyampaikan besaran penjualannya. ""Progresnya sangat bagus. Tapi, biasanya orang menunggu atlet Indonesia main dulu kan,"" ujarnya. Untuk acara pembukaan Asian Games 2018 di Stadion Utama Gelora Bung Karno (GBK) pada 18 Agustus 2018, dengan harga tiket antara Rp 750 ribu hingga Rp 5 juta. Sedangkan untuk penutupan pada 2 September 2018 di lokasi yang sama, harga tiketnya antara Rp 450 ribu hingga Rp 2 juta. Sementara harga tiket untuk tiap pertandingan dijual antara Rp 50 – 800 ribu. Harga tiket yang ditetapkan berbeda untuk tiap cabang olah raga dan babak. Saat ini, seluruh jadwal dan harga tiket untuk tiap pertandingan sudah bisa diakses melalui Kiostix.com.","Tiket Asian Games 2018 Dijual Bersama Premi Asuransi Mandiri AXA","http://katadata.co.id/berita/2018/07/27/tiket-asian-games-2018-dijual-bersama-premi-asuransi-mandiri-axa"
"Bunga deposito valuta asing (valas) tercatat terus meningkat. Perbankan berharap kenaikan tersebut bakal membuat pemilik valas, termasuk eksportir, lebih tertarik menempatkan dananya di perbankan domestik. Bahkan, sudah ada perbankan yang menawarkan bunga valas nyaris 3% per tahun untuk deposito berjumlah besar. Mengacu pada data Statistik Perbankan Indonesia per Mei,   bank umum terus bergerak naik sejak tahun lalu, berbanding terbalik dengan bunga deposito rupiah yang ketika itu cenderung turun. Per Mei, bunga deposito valas untuk jangka 1 bulan tercatat sebesar 1,35%, jauh di atas bulan yang sama tahun lalu yaitu 0,95%. Sementara itu, untuk deposito valas jangka 3 bulan, bunganya sebesar 1,86%, juga di atas bulan yang sama tahun lalu 1,34%. Lalu, untuk jangka 6 bulan, bunganya sebesar 1,76%, di atas bulan yang sama tahun lalu 1,6%. Terakhir, untuk jangka 1 tahun ke atas, bunganya sebesar 1,47%, juga melebihi bulan yang sama tahun lalu 1,25%. Direktur Utama PT Bank Mandiri (Persero) Tbk Kartika Wirjoatmodjo mengatakan, pihaknya bahkan sudah memberikan bunga deposito di kisaran 2,5-2,75% untuk deposito valas jumlah besar, jauh di atas sebelumnya di kisaran 0,75%. “Sudah per dua minggu yang lalu. Tapi enggak di   ya. Ini  ,” ucapnya di Kantor Kementerian Koordinator bidang Kemaritiman, Jakarta pada Senin (30/7). (Baca juga:  ) Ia menjelaskan, kenaikan bunga tersebut merupakan salah satu strategi untuk menarik pelaku usaha agar menempatkan valasnya dalam deposito di Bank Mandiri. Sebab, pelaku usaha pasti membandingkan  penempatan valas di berbagai instrumen, di dalam dan di luar negeri, untuk meraup keuntungan terbaik. Menurut dia, potensi   yang bisa diserap bank-bank pelat merah cukup besar yaitu mencapai US$ 500 juta per bulan. “Masalahnya tadi, mereka selalu membandingkan dengan total   mereka kalau mereka taruh di  ,” ujarnya. Lebih jauh, untuk meningkatkan daya tarik penempatan valas di dalam negeri, ia menyebut pentingnya instrumen-instrumen guna membuat pelaku usaha yakin bahwa “ ” yang diperoleh dari deposito sesuai dengan harapan mereka. “Karena memang sekarang dengan volatilitas seperti ini. Saya lihat memang banyak eksportir yang mulai   jual.  memang harus ada kepastian jual masa depan,” kata dia. Adapun upaya mendorong pasokan valas juga tengah menjadi fokus pemerintah. Tujuannya, untuk membantu stabilisasi nilai tukar rupiah terhadap dolar Amerika Serikat (AS). Bahkan, pekan lalu, Presiden Joko Widodo bersama para menteri ekonomi-nya menggelar pertemuan khusus dengan para taipan untuk mengimbau pemulangan dan konversi devisa hasil ekspor ke rupiah. Pemerintah mencatat ada sekitar 15% devisa hasil ekspor yang tak masuk ke Indonesia, sementara hitungan BI sekitar 10%. Padahal, ada ketentuan BI yang mewajibkan devisa tersebut diparkir di bank devisa dalam negeri, meski tak ada ketentuan batas minimal waktu penyimpanan.  (Baca juga:  ) Mengacu pada data BI, sepanjang Januari hingga Mei tahun ini, nilai ekspor untuk keseluruhan mata uang mencapai US$ 75,11 miliar, sedangkan untuk yang transaksinya dalam dolar AS mencapai US$ 70,93 miliar.","Bidik Devisa Hasil Ekspor, Perbankan Kerek Tinggi Bunga Deposito Valas","http://katadata.co.id/berita/2018/07/30/bidik-devisa-hasil-ekspor-perbankan-kerek-tinggi-bunga-deposito-valas"
"Penerbitan surat utang korporasi pada semester I 2018 mencapai Rp 75,28 triliun dari 55 perusahaan, meningkat 32% dibandingkan dengan periode yang sama tahun lalu. Perusahaan pembiayaan ( ) dan perbankan tetap mendominasi penerbitan surat utang dengan porsi sebesar 64,16% atau Rp 48,3 triliun. Menurut Senior Vice President Financial Institution Ratings Division PT Pemeringkat Efek Indonesia (Pefindo) Hendro Utomo, perusahaan kertas ( ) menjadi penerbit surat utang terbesar ketiga dengan nilai Rp 7,32 triliun. Perusahaan di sektor konstruksi berada di urutan keempat dan kelima, masing-masing dengan surat utang yang diterbitkan sebesar Rp 3,7 triliun dan Rp 3,23 triliun. Jika dilihat berdasarkan jenis surat utang, penerbitan obligasi paling banyak dilakukan oleh korporasi, yakni mencapai Rp 54,96 triliun atau 73%. Penerbitan   (MTN) berada di urutan kedua sebesar Rp 16,2 triliun atau 21,52%. Sisanya adalah penerbitan sekuritisasi aset sebesar Rp 1,82 triliun dan sukuk Rp 2,29 triliun. ""Dari total industri, pemeringkatan yang dilakukan Pefindo mencakup 44 perusahaan dengan nilai surat utang yang diterbitkan sebesar Rp 61,36 triliun,"" kata Hendro.   Minat penerbitan surat utang korporasi yang tinggi diprediksi akan berlanjut pada semester II 2018 meskipun akan sedikit melambat jika dibandingkan semester I 2017. Berdasarkan mandat pemeringkatan yang diterima Pefindo, potensi penerbitan surat utang korporasi pada semester II mencapai Rp 65,57 triliun dari 57 perusahaan. (Baca:  ) Rencana penerbitan MTN mendominasi sebesar Rp 24,71 triliun disusul obligasi Rp 10,26 triliun, dan realisasi penawaran umum berkelanjutan (PUB) Rp 13,05 triliun. Selain itu, ada encana penerbitan PUB baru senilai Rp 10,8 triliun, sekuritisasi Rp 4 triliun, dan sukuk Rp 2,75 triliun. Ekonom Pefindo Fikri C Permana mengatakan, kenaikan suku bunga acuan di Amerika Serikat (AS) yang diikuti kenaikan suku bunga acuan Bank Indonesia (BI). Hal ini menyebabkan kenaikan biaya dana. ""Pada awal tahun, kami masih optimis penerbitan surat utang tahun ini akan mencetak rekor baru. Tetapi, kenaikan suku bunga akan membuat penerbitan surat utang korporasi tahun ini sama seperti tahun lalu Rp 180 triliun,"" ujar dia. Pengetatan MTN Hendro menambahkan, proyeksi penerbitan surat utang pada semester II 2018 tersebut juga belum memperhitungkan ketentuan baru dari Otoritas Jasa Keuangan (OJK) yang memperketat penerbitan MTN.  Pasca kasus gagal bayar bunga MTN yang terjadi pada PT Sunprima Nusantara Pembiayaan (SNP Finance) pada Mei lalu, penerbitan MTN akan dikenakan persyaratan yang mirip dengan penerbitan obligasi. Perusahaan harus melakukan penawaran umum, menggunakan jasa penjamin emisi, dan harus mendapatkan izin efektif dari OJK.  Pefindo belum memiliki gambaran apakah aturan baru dari OJK tersebut akan memengaruhi mandat yang telah diterima oleh perusahaan. ""Ketentuan ini bisa berpengaruh dari sisi emiten yang selama ini menjadikan MTN sebagai sumber pendanaan alternatif. Dari sisi investor, bisa saja mereka mengkaji ulang kebijakan mereka untuk berinvestasi di MTN,"" kata Hendro. Perkembangan dari ketentuan ini baru bisa dilihat dalam beberapa kuartal mendatang.   (Baca:  )","Semester I 2018, Penerbitan Surat Utang Korporasi Rp 75,28 Triliun","http://katadata.co.id/berita/2018/07/31/semester-i-2018-penerbitan-surat-utang-korporasi-rp-7528-triliun"
"Otoritas Jasa Keuangan (OJK) sudah memberikan restu kepada Bank of Tokyo-Mitsubishi UFJ Limited (MUFG) untuk meningkatkan kepemilikan saham di PT   Tbk. menjadi 40% sehingga menjadi pemegang saham pengendali. Seiring publikasi mengenai restu tersebut, harga saham Bank Danamon melonjak. MUFG berencana mengakuisisi sebanyak 73,8% saham Bank Danamon yang dipegang Asia Financial (Indonesia) Pte. Ltd. (AFI) dan entitas terafiliasi lainnya. Akuisisi dilakukan dalam tiga tahap. Akuisisi tahap pertama, yaitu sebesar 19,9% sudah selesai. Selanjutnya, setelah mengantongi restu OJK, MUFG bakal melakukan akuisisi tahap kedua yaitu sebanyak 20,1% sehingga total kepemilikannya menjadi 40%. Mengacu pada data , harga saham Bank Danamon langsung melesat setelah informasi soal restu OJK tersebut dipublikasikan. Harga saham bank berkode bursa BDMN tersebut sempat mencapai 6.950 pada perdagangan Selasa (31/7) siang atau melonjak 11,2% dari penutupan sehari sebelumnya. Namun, berangsur turun hingga ditutup di level 6.575 atau naik 5,2% dari penutupan sehari sebelumnya. (Baca juga:  ) Pihak Bank Danamon menyatakan peralihan kepemilikan saham tidak akan membuat fokus bisnis bank berubah. ""Kami tetap berkomitmen menjalankan strategi perusahaan. Layanan dan kegiatan operasional perbankan tetap berjalan seperti biasa,"" seperti dikutip dari keterangan resmi Bank Danamon, Selasa (31/7). Adapun Bank Danamon bakal membutuhkan restu lanjutan dari OJK untuk meningkatkan kepemilikan menjadi 73,8%. Sebab, lembaga keuangan sebetulnya hanya bisa mengakuisi maksimal 40% saham bank umum. Hal itu berdasarkan Peraturan OJK Nomor 56/POJK.03.2016 tentang kepemilikan saham bank umum. Secara rinci, lembaga keuangan hanya bisa memiliki saham bank umum maksimal 40%, sedangkan lembaga keuangan non-bank maksimal 30%, dan perorangan maksimal 20%. Lembaga keuangan bisa memiliki saham lebih dari ketentuan tersebut dengan persetujuan OJK. Ada beberapa syarat yang harus dipenuhi lembaga keuangan bila ingin menguasai lebih dari 40% saham bank umum, antara lain, tingkat kesehatan yang baik, berbentuk perusahaan terbuka, dan berkomitmen untuk memiliki bank dalam jangka waktu tertentu, dan mendukung pengembangan perekonomian Indonesia.","OJK Restui Bank of Tokyo Jadi Pengendali, Harga Saham Danamon Melonjak","http://katadata.co.id/berita/2018/07/31/ojk-restui-bank-of-tokyo-jadi-pengendali-harga-saham-danamon-melonjak"
"Bank Indonesia (BI) telah mewajibkan seluruh pemrosesan transaksi dengan kartu debit dilakukan di dalam negeri melalui Gerbang Pembayaran Nasional ( ). Namun, masih ada tiga bank yang belum bisa memproses transaksi melalui GPN dan dikenakan sanksi, yaitu ICBC, Bank of China, dan Citibank. Deputi Direktur Departemen Elektronifikasi dan GPN Bank Indonesia (BI) Aloysius Donanto menjelaskan, ketiga bank tersebut belum bisa melakukan pemprosesan di dalam negeri lantaran masih membutuhkan keputusan dari pihak manajemen. ""Mereka diberi sanksi jadi tidak boleh pengembangan lebih lanjut,"" kata dia di kantornya, Jakarta, Senin (30/7). Untuk bisa memproses transaksi melalui GPN, perbankan setidaknya harus terkoneksi dengan dua lembaga  , pengelola GPN. Lembaga   yang dimaksud yakni PT Artajasa Pembayaran Elektronis (ATM Bersama), Rintis Sejahtera (ATM Prima), PT Daya Network Lestari ( ATM Alto) dan PT Jalin Pembayaran Nusantara (JPN). (Baca juga:  ) Sejauh ini, terdapat 95 bank yang telah terkoneksi dengan minimal dua lembaga  . Kemudian, total mesin Electronic Data Capture (EDC) yang sudah menggunakan GPN berjumlah 998.277 dari total 1.014.628 mesin. Adapun total transaksi melalui GPN dari Oktober 2017 hingga Juni 2018 telah mencapai Rp 11,58 triliun. Sementara itu, dari total 100 bank yang mengajukan penerbitan kartu berlogo GPN, yang disetujui oleh BI hanya 98 bank di antaranya. Sebab, dua bank lainnya sedang melakukan aksi korporasi. Adapun untuk mendukung GPN, BI mewajibkan perbankan untuk memastikan setiap nasabah memiliki minimal satu kartu berlogo GPN pada 2022. (Baca juga:  ) BI tidak melarang nasabah untuk memiliki kartu lainnya yang berlogo prinsipal asing. Sebab, kartu berlogo GPN hanya bisa digunakan untuk transaksi di dalam negeri. Adapun kartu berlogo prinsipal asing tetap bisa dipakai untuk transaksi domestik. Namun, pemprosesan untuk transaksi domestik tetap menggunakan sistem GPN. Melalui penggunaan GPN, BI mencatat terjadi penghematan biaya transaksi hingga Rp 17,77 miliar per hari. Secara rinci, Aloysius mengatakan sebelum ada GPN, biaya transaksi kartu debit/ATM mencapai Rp 25 miliar per hari lantaran menggunakan jasa prinsipal asing, seperti Master Card dan Visa. “Saat ini efisiensi transaksi  (antarbank)   mencapai Rp 7,23 miliar per hari,” ujarnya.","Transaksi Debit Belum Pakai GPN, Bank Tiongkok dan AS Disanksi BI","http://katadata.co.id/berita/2018/07/31/transaksi-debit-belum-pakai-gpn-bank-tiongkok-dan-as-disanksi-bi"
" meluncurkan layanan aplikasi   yang diberi nama Permata Mobile X. Melalui aplikasi ini, perbankan Grup Astra tersebut menargetkan dapat menjaring 2 juta nasabah baru, dalam waktu 2 tahun.  “Sekarang jumlah rekening kami hampir 2 juta nasabah. Kalau bisa sampai 4 juta dalam waktu dua tahun. Kalau bisa lebih cepat,” kata Direktur Utama Bank Permata Ridha DM Wirakusumah usai peluncuran aplikasi ini di Jakarta, Rabu (1/8). Meski menargetkan jumlah nasabahnya naik dua kali lipat, peluncuran aplikasi ini sebenarnya salah satu upaya meningkatkan layanan Bank Permata. Berapa pun jumlah nasabah yang akan terjaring, yang terpenting kemudahan nasabah dalam bertransaksi. (Baca:  ) Ridha mengatakanBank Permata akan terus berinvestasi dalam pengembangan aplikasi ini secara berkelanjutan, dengan menempatkan teknologi yang tepat dan sesuai. Sayangnya, dia tidak mau mengungkapkan berapa besaran nilai investasi untuk pengembangan aplikasi Permata Mobile X. Dia menjelaskan investasi yang dikeluarkan paling besar untuk aplikasi ini bukan di teknologinya, tapi lebih pada sumber daya manusianya (SDM). Menurutnya, dengan teknologi seperti apapun, jika SDM-nya buruk, maka teknologinya tidak akan berkembang. Direktur Teknologi & Operasi Bank Permata Abdy D. Salimin mengatakan Permata Mobile X merupakan penyederhanaan dari kerumitan perbankan dan menghilangkan kebosanan bertransaksi. Makanya, Bank Permata mendesain ulang dan merombak total aplikasi   sebelumnya. “Permata Mobile X menjadi lebih menarik, cepat dan mudah digunakan sebagai aplikasi yang menyenangkan dalam melakukan perbankan digital dan menjadikannya masa depan  ,” katanya. (Baca:  ) Pada salah satu fiturnya, Permata Mobile X dapat melakukan transfer menggunakan nomor telepon seluler (ponsel). Namun, nasabah masih harus mengganti nomor ponselnya pada aplikasi tersebut, apabila bepergian ke luar negeri. “Permata Bank  -nya jadi mandul (kalau di luar negeri),” kata salah satu nasabah Bank Permata yang juga merupakan CEO KapanLagi Youniverse (KLY) Steve Christian. Menurutnya hal ini menjadi pekerjaan rumah yang harus dibereskan Bank Permata kedepannya. Selain dapat melakukan transfer dengan menggunakan nomor ponsel, dengan aplikasi Permata Mobile X, memungkinkan nasabah dapat melihat saldo dengan cepat tanpa   terlebih dahulu. Aplikasi ini juga memiliki kemampuan untuk   dengan cepat melalui WhatsApp, LINE, SMS dan email, sekaligus dapat melihat mutasi rekening di semua akun selama lebih dari 12 bulan. Aplikasi ini juga memungkinkan nasabah membuka rekening giro, tabungan dan deposito berjangka, lalu membeli dan menjual reksadana dan obligasi. (Baca:  )","Luncurkan Aplikasi Mobile, Bank Permata Targetkan 2 Juta Nasabah Baru","http://katadata.co.id/berita/2018/08/01/luncurkan-aplikasi-mobile-bank-permata-targetkan-2-juta-nasabah-baru"
"Bank Permata berencana menurunkan persentase   atau   (DP) dalam penyaluran Kredit Pemilikan Rumah (KPR). Hal ini terkait penerapan relaksasi aturan batas kredit yang diberikan perbankan terhadap nilai agunan atau    (LTV), yang resmi berlaku mulai kemarin. Direktur Utama Bank Permata Ridha DM Wirakusumah mengatakan dengan adanya relaksasi ini, Bank Permata akan menurunkan sedikit persentase DP untuk rumah pertama menjadi 10% hingga 14%. Sebelumnya, bank ini menerapkan batas minimal DP KPR sebesar 15%. ""Pemerintah sudah melonggarkan, tapi kami memang sudah mengarah ke sana (mengurangi  DP KPR). Pemerintah   ke situ, kami akan ikut dan lebih proaktif,"" katanya di Jakarta pada Rabu (1/8). (Baca:  ) Pengurangan uang muka ini hanya dilakukan untuk KPR konvensional. Sementara untuk KPR Syariah, ketentuannya masih tetap. Alasannya, saat ini Bank Permata sudah memberikan ketentuan DP untuk KPR Syariah sebesar 10%. Dia mengatakan masyarakat bisa memilih menggunakan KPR Syariah Bank Permata, karena uang muka dan bunganya yang rendah. Menurutnya, bisnis sektor perumahan sangat bagus sekarang. Terutama di DKI Jakarta yang separuh warganya belum memiliki rumah. Untuk penyaluran KPR, Bank Permata akan menyasar semua lapisan masyarakat. Tidak hanya kalangan menengah ke atas, tapi akan mulai menyasar masyarakat menengah ke bawah. (Baca:  Saat ini Bank Permata sedang menggodok suatu formula bersama perusahaan plat merah yang bergerak di bidang properti, yaitu PT PP Properti. Kerja sama ini dilakukan untuk meningkatkan penyaluran KPR bagi kalangan menengah ke bawah di seluruh Indonesia. Meski begitu, formula yang dirancang bukanlah dengan menerapkan uang muka KPR 0%. Dia menilai pemberian DP 0% cukup berisiko bagi penyaluran kredit. Apalagi Bank Permata sedang berjuang untuk memperbaiki kualitas kredit seret alias Non-Performing Loan (NPL) yang masih tinggi. Pada Mei lalu, posisi NPL Bank Permata mencapai 4,5% hingga 4,6%. ""Tapi ini sudah lebih bagus dari yang dulu-dulu,"" kata Ridha. Seperti diketahui, Bank Indonesia mulai memberlakukan kebijakan relaksasi LTV pada 1 Agustus 2018.  Relaksasi ini sebagai perangsang pertumbuhan kredit perbankan, karena suku bunga acuan BI 7 Days Repo Rate dinaikan. Kebijakan LTV kali ini membebaskan bank untuk menetapkan besaran DP untuk KPR. (Baca:  )","Bank Permata Akan Turunkan Uang Muka KPR Sebesar 5%","http://katadata.co.id/berita/2018/08/02/bank-permata-akan-turunkan-uang-muka-kpr-sebesar-5"
"PT   (SMF) resmi mendirikan Unit Usaha Syariah (UUS). Dengan didirikannya unit ini, SMF berharap, makin banyak bank syariah yang mau kerja sama dengan SMF dalam pembiayaan perumahan, khususnya untuk masyarakat berpenghasilan rendah (MBR) “Selama ini, SMF sudah melakukan pembiayaan syariah. Biar sesuai dengan aturan, makanya di SMF dibuat UUS-nya ini,” kata Direktur Utama SMF Ananta Wiyogo. di Jakarta usai acara peresmian UUS SMF, Senin (23/7). Menurut Ananta, Indonesia merupakan negara yang memiliki potensi besar bagi industri keuangan syariah dengan komposisi demografis dan pertumbuhan ekonomi yang menjanjikan. Selain itu, tren pasar global mulai berubah, pasar modal lebih dominan dari peran sistem perbankan ( ) dalam alokasi sumber daya keuangan. (Baca:  ) Namun, kata Ananta, sampai saat ini pengaruh industri keuangan syariah masih belum signifikan. Pangsa pasar keuangan syariah lebih kecil dibandingkan dengan industri keuangan konvensional. “Sebagai BUMN di bawah Kementerian Keuangan, SMF mengemban tugas untuk membangun dan mengembangkan Pasar Pembiayaan Sekunder Perumahan melalui sekuritisasi dan pembiayaan,” kata Ananta. SMF akan memberdayakan UUS semaksimal mungkin dalam meraup potensi pembiayaan keuangan syariah. Harapannya, UUS ini dapat memperkuat sistem pembiayaan perumahan di Indonesia melalui transaksi Sekuritisasi Efek Beragun Aset Syariah berbentuk Surat Partisipasi (EBA-SP Syariah). (Baca:  ) Ananta mengatakan rencana penerbitan EBA-SP Syariah ini berpotensi memberikan banyak manfaat bagi pasar modal di Indonesia, khususnya di industri keuangan syariah. EBA-SP Syariah akan memperkaya instrumen investasi produk pasar modal syariah. Bagi investor, EBA-SP Syariah menjadi alternatif instrumen investasi yang berisiko rendah. Efek ini juga akn bisa memperbesar pangsa pasar modal syariah di Indonesia. Bagi perbankan syariah, penerbitan EBA-SP Syariah dapat menjadi alternatif solusi untuk memperoleh kembali dana yang telah disalurkannya dalam bentuk Kredit Pemilikan Rumah iB, tanpa perlu menunggu tagihan KPR iB yang dimilikinya jatuh tempo. Sehingga akan mengurangi risiko kesenjangan jangka waktu ( ). “Kami optimistis EBA-SP syariah akan memberikan warna baru bagi pasar modal syariah Indonesia. Sebelumnya berbagai efek berbasis syariah mulai diperkenalkan dan diterbitkan,” kata Ananta. (Baca:  ) SMF merupakan Badan Usaha Milik Pemerintah (BUMN) di bawah Kementerian Keuangan yang didirikan pada 2005. Perusahaan ini ditugaskan untuk membangun dan mengembangkan pasar pembiayaan  sekunder perumahan. Tahun ini SMF tengah fokus memperkuat perannya sebagai   untuk mengurangi beban pemerintah dalam pelaksanaan program subsidi Fasilitas Likuiditas Pembiayaan Perumahan (FLPP). Kinerja keuangan SMF pada paruh pertama tahun ini cukup baik. Perseroan membukukan laba bersih Rp 219,9 miliar pada semester I-2018. Realisasi ini sudah memenuhi 53,57% dari target tahun ini sebesar Rp 410,6 miliar. Adapun pendapatannya sebesar Rp 621 miliar atau 49,52% dari target sebesar Rp 1,25 triliun.","SMF Resmi Dirikan Unit Usaha Syariah, untuk Pembiayaan Rumah","http://katadata.co.id/berita/2018/07/23/smf-resmi-dirikan-unit-usaha-syariah-untuk-pembiayaan-rumah"
"Dua bank milik negara, PT Bank Mandiri (Persero) Tbk dan PT Bank Negara Indonesia/BNI (Persero) Tbk, kompak menjaga tingkat   hingga akhir tahun ini. Padahal, Bank Indonesia menaikkan suku bunga acuan BI 7 Days Repo Rate secara agresif sepanjang Mei-Juni lalu menjadi 5,25%. “Suku bunga tetap akan ditahan sampai akhir tahun,” kata Direktur Utama Bank Mandiri Kartika Wirjoatmodjo ketika ditemui di Plaza Mandiri, Jakarta usai Paparan Kinerja Semester I-2018 pada Kamis (19/7). Khusus suku bunga Kredit Pemilikan Rumah (KPR), pria yang akrab disapa Tiko ini, menyatakan Bank Mandiri masih enggan menaikannya. Alasannya, pertumbuhan kredit sektor ini masih di bawah 10%. Pertimbangan lain, sektor KPR untuk rumah pertama dan pengembang besar, persaingan dengan bank lain cukup ketat. (Baca:  ) Dengan tidak menaikkan suku bunga KPR, Bank Mandiri optimistis bisa mendorong pertumbuhan kredit sektor tersebut tahun ini. “Rasanya kami tidak akan naikkan dulu sampai akhir tahun. Nanti akhir tahun kami  ,” katanya. Pada kesempatan yang sama, Direktur Bisnis Kecil dan Jaringan Bank Mandiri Hery Gunardi mengatakan sebetulnya Bank Mandiri sudah menaikan  . Bank Mandiri sudah menyesuaikannya dengan menggunakan dasar angka suku bunga Bani Indonesia (BI) pada bulan Juni. Pada dasarnya Bank Mandiri masih terus melihat perkembangan pasar, seperti bagaimana pengaruh persaingan dan juga lingkungan bisnis yang ada. Untuk saat ini Bank Mandiri belum memiliki rencana menaikkan suku bunga. (Baca:  ) PT Bank Negara Indonesia (BNI) juga belum berencana menaikan suku bunga deposito. Direktur Utama BNI Achmad Baiquni mengatakan likuiditas banknya saat ini sebesar  87%. Itu dinilainya masih cukup baik dalam bisnisnya. Namun, Baiquni mengatakan bisa saja mereka menaikkan suku bunga deposito sebesar 0,25%-0,5% pada semester II-2018. “Kami tidak perlu berlomba-lomba mencari bunga dengan yang suku bunganya tinggi,” kata Baiquni ketika ditemui di Gedung BNI, Jakarta pada Rabu (18/7). BNI memastikan tidak akan menaikkan suku bunga kredit hingga akhir tahun ini. Direktur Keuangan Bank BNI Anggoro Eko Cahyo mengatakan, saat ini memang belum disesuaikan karena lebih memiliih fokus kepada debitur-debitur. Dia mengatakan, kenaikan suku bunga kredit perlu melalui dilakukan secara selektif. Jika tidak, maka akan berdampak pada keberlangsungan kredit dan kualitas kreditnya. “Kami harus selektif menaikkan bunga. Tentu kami harus review betul apakah debiturnya punya kemampuan atau tidak. Kalau tidak, kan jangan naikin dulu,” ujarnya. (Baca:  )","Dua Bank BUMN Belum Akan Naikkan Bunga Hingga Akhir Tahun","http://katadata.co.id/berita/2018/07/20/dua-bank-bumn-belum-akan-naikkan-bunga-hingga-akhir-tahun"
